review,notes,dates,accords_avis,dessaccords_avis,cleanned_review,classification
Belle blague je les eu gratuitement résultat mon pote et devenu mon ennemi je vous déconseille cette blague c'est vraiment le pire jeu de foot ne l'achetez pas c'est vraiment une honte les bug a chaque fois je suis devant les cage mon joueur ne tire pas s'arrête de bougez c'est vraiment un sketch,0,03/10/2023,21,0,belle blague gratuitement résultat mon pote devenu mon ennemi déconseille blague vraiment pire jeu foot achetez vraiment honte bug chaque fois suis devant cage mon joueur tire arrête bougez vraiment sketch,anger
"EA qui comme d'habitude s'engraisse avec les pigeons mais le jeu est de pire en pire. Une Caaataaastrophe ""Simulation"" de football lol.Vivement qu'un concurrent vienne s'immiscer dans la lutte ! C'est pas près d'arriver malheureusement !",0,29/09/2023,17,0,comme habitude engraisse avec pigeons jeu pire pire caaataaastrophe simulation football lol vivement concurrent vienne immiscer lutte près arriver malheureusement,sad
Ils ont réussi à faire pire que Fifa 23 ! Milieu et défense à l’ouest. On a l’impression que c’est fait exprès pour avoir des matchs à 789 buts… À fuir,0,29/09/2023,15,0,ont réussi faire pire fifa milieu défense ouest impression fait exprès matchs buts fuir,sad
"Adepte des FIFA depuis le 96 j'ai toujours été convaincu par ce que proposait la marque avec des hauts et des bas certes mais un certain niveau de qualité et de prestige. Et malgré quelques allers-retours chez PES j'y suis toujours revenu car FIFA restait une référence. Mais cette année cela ne peut plus être le cas. Ce EAFC24 n'a plus grand chose à voir avec une simulation de football dans la mesure où le match en lui-même le cœur du jeu de foot est une succession de catastrophes. Certes le contenu est pléthorique mais c'est une vaine consolation quand la finalité du jeu jouer au football est une telle souffrance. Même en faisant abstraction du online mode dans lequel le gameplay devient carrément grotesque le jeu ne procure aucun plaisir tant la physique du ballon des joueurs leurs vitesses relatives les passes les ""tirs"" le jeu des gardiens tout cela est complètement à côté de la plaque. Même l'opus précédent reconnu comme mauvais mais ayant l'excuse de la transition ne proposait pas un niveau de simulation aussi désastreux. Aussi je suis extrêmement surpris par la note attribuée par le testeur j'ai vraiment l'impression d'avoir joué à un autre jeu que lui.Points positifs :- Le mode carrière joueur très complet et permettant de faire abstraction du gameplay à condition de contrôler le joueur seul.- Le contenu.Points négatifs :- Jouer un match de football dans le jeu : tout est à revoir la physique des joueurs des ballons les passes absurdes le combo tir-arrêt du gardien totalement irréaliste L'IA des coéquipiers en phase défensive l'IA des coéquipiers en phase de possession l'IA adverse le online qui transforme tout cela en grand n'importe quoi...",5,29/09/2023,34,3,adepte fifa depuis toujours été convaincu proposait marque avec hauts bas certes certain niveau qualité prestige malgré quelques allers retours chez pes suis toujours revenu car fifa restait référence année cela peut être cas eafc grand chose voir avec simulation football mesure match lui cœur jeu foot succession catastrophes certes contenu pléthorique vaine consolation quand finalité jeu jouer football telle souffrance faisant abstraction online mode lequel gameplay devient carrément grotesque jeu procur,sad
Ce n'est pas du football les joueurs glissent de partout  aucun équilibre entre l'attaque et la défense..Jeu catastrophique en l'état .Arnaque totale a 70 euros,0,30/09/2023,14,0,football joueurs glissent partout aucun équilibre entre attaque défense jeu catastrophique état arnaque totale euros,anger
J'ai même plus les mots... Quelle médiocrité bon sang (et pour rester poli) ! Chez EA plus aucun effort à fournir aucune concurrence donc on reste au mieux sur nos acquis et on continue de pondre une daube de jeu arcade avec son jeu de cartes claqué mais hyper lucratif qui convient à tous les footix.Perso je m'en balancerais royalement des licences si un autre éditeur composés de vrais passionnés nous sortaient une vraie simulation de football avec un gameplay réaliste. Si seulement un autre acteur entrait dans la danse. Y a tellement une place à prendre.,0,30/09/2023,14,0,mots quelle médiocrité bon sang rester poli chez aucun effort fournir aucune concurrence reste mieux nos acquis continue pondre daube jeu arcade avec son jeu cartes claqué hyper lucratif convient tous footix perso balancerais royalement licences autre éditeur composés vrais passionnés nous sortaient vraie simulation football avec gameplay réaliste seulement autre acteur entrait danse tellement place prendre,anger
Copié collé du 23 honteux de vendre ça 70 euros. C'est tellement dommage que les gens soient encore assez fou pour bien noter ce jeu. Ça vous fait rien franchement ? À un moment donné faudrait peut-être leur faire comprendre qu'ils ont fait de la *****.,0,30/09/2023,20,1,copié collé honteux vendre euros tellement dommage gens soient encore assez fou bien noter jeu fait rien franchement moment donné faudrait peut être leur faire comprendre ont fait,anger
La déception est totale  franchement c'est le pire opus de la série fifa 23 était limite bien meilleur 80e pour ça franchement c grave.passez votre chemin.,0,29/09/2023,13,0,déception totale franchement pire opus série fifa était limite bien meilleur franchement grave passez votre chemin,sad
EA de pire en pire. Des voleurs complet. C’est le plus nul de tous les fifa. Ça en devient écœurant même. Les modélisations de joueurs connus pas finaliser maillots manquants.Et encore pire ils ont totalement supprimé les scènes d’entrées de matchs. (Fini l’hymne de la LDC ligue anglaise bundesliga séria A liga etc…) avec l’entrée des joueurs hyper bâclé.Ca ne ressemble même plus à un jeu de simulation de football.Un désastre complet surtout pour le prix.Totalement dégoûté par ce jeu de m….Et surtout cette entreprise de bons a riens avec leur développeurs hyper incompétents.Gameplay à chier que des scores de tennis gardiens passoir …Le jeu à fuir !,1,29/09/2023,25,2,pire pire voleurs complet nul tous fifa devient écœurant modélisations joueurs connus finaliser maillots manquants encore pire ont totalement supprimé scènes entrées matchs fini hymne ldc ligue anglaise bundesliga séria liga etc avec entrée joueurs hyper bâclé ressemble jeu simulation football désastre complet surtout prix totalement dégoûté jeu surtout entreprise bons riens avec leur développeurs hyper incompétents gameplay chier scores tennis gardiens passoir jeu fuir,sad
Encore une année où je perd de l’argent  EA de pire en pire  les joueurs qui beug  les gardien de la vrai grosse merde 0 arrêt  la communauté en ligne j’en parle pas les gens ne savent plus jouer au football il savent faire que des tout droit des l’engagement du match 0 création de jeux sa devient écœurant les femmes qui ont de meilleurs stats que les mecs du jamais vue ok les femme savent jouer au foot mais faut pas abuser non plus  les faute coup d’épaule ou pied sur le ballon carton rouge et tacle de boucher c’est avertissement voir jaune je parle pas de beug ou de scrip quand tu mène au score du genre 3-1 à la mi temp et deuxième mi temp l’adversaire a tout les contre improbable du jeu et remonte le score voir passe devant en même pas 10 min  les changements de joueur se font aléatoirement donc sa devien ingérable en défense ect EA manger vous un mur tant qu’il n’y aura pas d’amélioration je supprime le jeu.,0,04/10/2023,12,0,encore année perd argent pire pire joueurs beug gardien vrai grosse merde arrêt communauté ligne parle gens savent jouer football savent faire droit engagement match création jeux devient écœurant femmes ont meilleurs stats mecs jamais vue femme savent jouer foot faut abuser non faute coup épaule pied ballon carton rouge tacle boucher avertissement voir jaune parle beug scrip quand mène score genre temp deuxième temp adversaire contre improbable jeu remonte score voir passe devant min changements joueur f,sad
jai l'impression de voir les mêmes Avis q en 2022 2023  pourquoi changer un truc nul qui rapporte des millions   leurs but c'est de vous faire croire que tout les ans ça  s'améliore arrêté de les hacheter,1,05/10/2023,10,0,jai impression voir mêmes avis pourquoi changer truc nul rapporte millions leurs but faire croire ans améliore arrêté hacheter,anger
Le pire jeux de l'histoire 70e ? Foutage de gueulle une mise à jour aurait plus honnête la c est clairement du vol. La defense catastrophique pour anticipé entre les lignes pleins d incoherences dans les mouvements duel contre j en parle pas des tetes en gros c est fifa 23 en plus nul et oui c est la marque fifa depuis 7 ans sa régresse et font des milliards euros sur notre dos alors qu avec tout cet argent il devrai aisement faire évoluer le jeu dans le sens de la demande de leurs enrichisseurs.terminer fifa en attente d un concurrent qui sera honnete et recuperer tout les clients.Aller les gars en parler autour de vous t a ce renseigner pour faire évoluer cette idee de trouver un concurrent,0,03/10/2023,10,0,pire jeux histoire foutage gueulle mise jour aurait honnête clairement vol defense catastrophique anticipé entre lignes pleins incoherences mouvements duel contre parle tetes gros fifa nul oui marque fifa depuis ans régresse font milliards euros notre dos alors avec cet argent devrai aisement faire évoluer jeu sens demande leurs enrichisseurs terminer fifa attente concurrent sera honnete recuperer clients aller gars parler autour renseigner faire évoluer idee trouver concurrent,anger
Absolument scandaleux de proposer un jeu de foot aussi buggé.Défense catastrophique des gardiens atroces tout le système défensif est défaillant. 😡Il est pratiquement impossible de jouer sereinement sans vivre des situations grotesques pendant un match.Des scores de tennis des buts complètement WTF mais le pire est cet effet de patinoire où les joueurs glissent constamment et ne tiennent pas debout 😫Merci aux 10 Heures de l’EA Play de m’avoir épargné cet attentat vidéoludique.,2,29/09/2023,20,2,absolument scandaleux proposer jeu foot aussi buggé défense catastrophique gardiens atroces système défensif défaillant pratiquement impossible jouer sereinement sans vivre situations grotesques pendant match scores tennis buts complètement wtf pire cet effet patinoire joueurs glissent constamment tiennent debout merci aux heures play épargné cet attentat vidéoludique,sad
"Une arnaque tout simplement.Le jeu est pire que FIFA 23. La défense est totalement INJOUABLE impossible de prendre la balle aux attaquants (qui glissent comme si ils étaient à la patinoire) les animations de leur blague ""HYPERMOTION V"" sont grotesques les animations sont pires que les Fifa précédents ! Il y a une vidéo de fifa 19 qui tournent en ce moment qui montrent que ça a régressé à ce niveau là je vous invite à aller la voir. Les engagements toujours autant bugés la profondeur toujours autant dévastatrice les défenseurs qui reculent pour laisser passer les attaquants et j'en passe. Sam Kerr et ses 1m63 qui bougent mon Van Dijk et gagne des duels de la tête de défenseurs de plus de 1m90 mais WTF ????????Il y a pas un match qui ne finit pas par un score de tennis impossible d'être en place tellement ça va dans tous les sens. Ce jeu mérite un 0 pointé tellement EA sports se fiche de la g***** du monde. J'en ai terminé avec les jeux de foot après plus de 20 ans de bon et loyaux services mais je ne suis plus le public visé. En Bref passez votre chemin sinon vos manettes vont y passer.",0,07/10/2023,14,1,arnaque simplement jeu pire fifa défense totalement injouable impossible prendre balle aux attaquants glissent comme étaient patinoire animations leur blague hypermotion grotesques animations pires fifa précédents vidéo fifa tournent moment montrent régressé niveau invite aller voir engagements toujours autant bugés profondeur toujours autant dévastatrice défenseurs reculent laisser passer attaquants passe sam kerr ses bougent mon van dijk gagne duels tête défenseurs wtf match finit score tennis impossibl,sad
Le pire « fifa ». Impossible de défendre correctement des grands ponts à gogo un gardien = passoire. Extrêmement déçu une vrai daube. Rarement un tel échec.,2,08/10/2023,12,1,pire fifa impossible défendre correctement grands ponts gogo gardien passoire extrêmement déçu vrai daube rarement tel échec,sad
Plus de 10 ans que je joue à cette licence. Je pense que je n'ai jamais vu un jeu aussi mauvais et aussi mal fini.J'ai l'impression que EA a rassemblé tous les bugs des opus précédents dans celui ci rien ne va. Je n'ai même pas envie de les énumérer tellement il y en a. C'est le gameplay le plus nul injouable et insipide tous FIFA confondu.Sinon rien n'a changé dans tous les modes de jeu. C'est toujours les mêmes qu'il y a 5 ans mais ça on a l'habitude. Les menus sont lents ça aussi c'est raté. Bref j'ai pas tout en tête mais c'est de loin le plus mauvais jeu que j'ai pu testé. Un beau 0 bien mérité.,0,13/10/2023,7,0,ans joue licence pense jamais jeu aussi mauvais aussi mal fini impression rassemblé tous bugs opus précédents celui rien envie énumérer tellement gameplay nul injouable insipide tous fifa confondu sinon rien changé tous modes jeu toujours mêmes ans habitude menus lents aussi raté bref tête loin mauvais jeu testé beau bien mérité,sad
depuis fifa 08 j'ai acheté tous les fifa à la sortie depuis quelques années déjà je voyais qu'ils se foutaient de nous. je n'ai mis d'avis mais la je suis obligé le gameplay est casi le même depuis fifa 18. j'en ai marre de payer des maj chaques années. 0/20 bien mérité,0,02/10/2023,7,0,depuis fifa acheté tous fifa sortie depuis quelques années déjà voyais foutaient nous mis avis suis obligé gameplay casi depuis fifa marre payer maj chaques années bien mérité,anger
Essayé sur l'EA access et franchement c'était largement suffisant pour voire qu'il y a 0 évolution (comme le note que je lui attribue) par rapport aux précédents opus. On ne sent même plus la différence pad en main. Là on tombe vraiment dans l'escroquerie! N'achetez pas cette arnaque! Gardez votre argent pour un jeu qui en vaut la peine.,0,02/10/2023,7,0,essayé access franchement était largement suffisant voire évolution comme note lui attribue rapport aux précédents opus sent différence pad main tombe vraiment escroquerie achetez arnaque gardez votre argent jeu vaut peine,anger
Chaque année les jeux sont de plus en plus nul et ce FC24 est le pire jeu de foot depuis plusieurs années.EA a osé retiré les entrées des joueurs ce qui gâche tout je ne comprends pas comment ils ont pu faire ça. L'entrée et la présentation des joueurs les hymnes et les compositions des équipes font parti du match sans ça je n'ai aucune envie d'y jouer sans parler du peu de nouveautés.,0,01/10/2023,7,0,chaque année jeux nul pire jeu foot depuis plusieurs années osé retiré entrées joueurs gâche comprends comment ont faire entrée présentation joueurs hymnes compositions équipes font parti match sans aucune envie jouer sans parler peu nouveautés,anger
EA a tué cette licence avec FUT il n'y a rien d'autre à dire.Ce jeu de carte n'a rien à faire sur un jeu de simulation de foot.On ne peut même pas faire du 2v2 3v3 ect avec des potes en ligne en 2023,1,20/10/2023,5,0,tué licence avec fut rien autre dire jeu carte rien faire jeu simulation foot peut faire ect avec potes ligne,neutral
Pire jeu on change pas une équipe qui gagne. Je pensais que ça allait changer ne serait-ce qu'un peu avec le nouveau je pensais mal il n'en est guère. À fuir.,0,09/10/2023,5,0,pire jeu change équipe gagne pensais allait changer serait peu avec nouveau pensais mal guère fuir,sad
Le pire fifa depuis que j’y joue (fifa 09). Le jeu fait que bug dans les menus. Des bug daffichage 1 match sur deux. Au niveau des matchs c’est au moins méritant de gagner. Le jeu décide à l’avance qui va gagner et ne s’en cache plus avec des contres favorables à tout vas. Un bon fifa bien nul qui me donne envie d’arrêter complètement se je de m***,1,09/10/2023,5,0,pire fifa depuis joue fifa jeu fait bug menus bug daffichage match deux niveau matchs moins méritant gagner jeu décide avance gagner cache avec contres favorables vas bon fifa bien nul donne envie arrêter complètement,sad
Une simple copie de fifa 23. Des ajouts mineurs qui ne nécessitent pas un tarif aussi élevé. Pour couronner le tout les cinématiques d’entrées ont été supprimées…La priorité est clairement donner à FUT au détriment des joueurs solo.,5,09/10/2023,8,1,simple copie fifa ajouts mineurs nécessitent tarif aussi élevé couronner cinématiques entrées ont été supprimées priorité clairement donner fut détriment joueurs solo,sad
lamantable des score fleuves de 7 à 6 pas de constructions des attaquants sur scooter et surtout aucun plaisir a jouer.pourtant je n'en veux pas à ea j'en veux a konami et aux joueurs qui n'on pas acheter ce jeux merveilleux qu'etait pes 2020,1,03/10/2023,7,1,lamantable score fleuves constructions attaquants scooter surtout aucun plaisir jouer pourtant veux veux konami aux joueurs acheter jeux merveilleux etait pes,sad
Comme d'hab on fait un copier coller chaque année en changeant seulement le nom et les graphismes et puis ce n'est pas en ajoutant quelque petits truc par ci par là qu'on fait un nouveau jeux et le pire c'est que ce n'est pas que EA toute les grandes boîtes du JV sont devenu une catastrophe.,0,09/10/2023,4,0,comme hab fait copier coller chaque année changeant seulement nom graphismes puis ajoutant quelque petits truc fait nouveau jeux pire toute grandes boîtes devenu catastrophe,sad
Sincèrement déçu de ce jeux remplis de bug et de honte . Surtout au niveau du gardien et de la défense . Vous avez pas la sensation de contrôler votre jeux. Mais plus une sensation de jouer à la roulette . Rouge ou noir . Gagner un match c’est avoir de la chance que les bug sois de votre coter 👍,1,02/10/2023,4,0,sincèrement déçu jeux remplis bug honte surtout niveau gardien défense avez sensation contrôler votre jeux sensation jouer roulette rouge noir gagner match chance bug sois votre coter,sad
Honnêtement le nombre de choses qui ont été supprimés de fifa 23 a ce jeu.. On est censé parler de progrès d’année en année mais encore une fois EA se fiche bien de nous plus de cinématique d’entrée des graphismes digne d’une console portable.Et faire payer les gens un prix fort pour ce navet ?? On peut même plus régler la luminosité c’est dire à quel point c’est grotesque.Le gameplay c’est cataclysmique en mode online c’est que des passes interceptées un forcing pour savoir qui aura le ballon Bref 1/20 c’est déjà beaucoup,1,01/10/2023,4,0,honnêtement nombre choses ont été supprimés fifa jeu censé parler progrès année année encore fois fiche bien nous cinématique entrée graphismes digne console portable faire payer gens prix fort navet peut régler luminosité dire quel point grotesque gameplay cataclysmique mode online passes interceptées forcing savoir aura ballon bref déjà beaucoup,sad
"Chaque année on nous fait les mêmes promesses les mêmes annonces :""EA a écouté les joueurs"" ""Le mode carrière totalement repensé et pleins de nouveauté""...Et au final... on se retrouve dans lequel rien n'évolue hormis les maillots et les compositions d'équipe...Merci EA PLAY d'avoir permis de tester ce jeu 10h et dissuader ainsi de l'achat d'une telle purge...Il n'y a plus aucun fun à jouer à FIFA... le jeu à perdu des licences et demeure sur ce point moins complet que Fifa 16...l'âme du jeu s'est envolé jusque dans les menus moche et pas pratique du jeu.Je ne parlerais pas des scripts... des bugs que l'on peut rencontrer... L'absence de concurrence sérieuse à vraiment justifié à EA que l'on pouvait nous prendre pour des jambons. FUYEZ remettez FIFA 15 dans la console vous vous amuserez plus !",1,29/09/2023,6,1,chaque année nous fait mêmes promesses mêmes annonces écouté joueurs mode carrière totalement repensé pleins nouveauté final retrouve lequel rien évolue hormis maillots compositions équipe merci play permis tester jeu dissuader ainsi achat telle purge aucun fun jouer fifa jeu perdu licences demeure point moins complet fifa âme jeu envolé jusque menus moche pratique jeu parlerais scripts bugs peut rencontrer absence concurrence sérieuse vraiment justifié pouvait nous prendre jambons fuyez remettez fifa con,sad
Il faut être clair. Il n'y a plus aujourd'hui de simulations de foot aujourd'hui. FC24 n'est pas un mauvais jeu dans l'absolu. Mais ce n'est pas une simulation de foot tant le gameplay est très loin de faire ressentir (à minima) les sensations d'un match de foot. Donc ceux qui apprécient une interprétation spectaculaire du foot énormément de contenus et un joli habillage allez-y. Pour les autres oubliez FC24.,8,03/10/2023,5,1,faut être clair aujourd hui simulations foot aujourd hui mauvais jeu absolu simulation foot tant gameplay très loin faire ressentir minima sensations match foot ceux apprécient interprétation spectaculaire foot énormément contenus joli habillage allez autres oubliez,sad
"Un 04/20 pour le même nombre de mots qui résume ce Ea Sports Fc 24 "" de la grosse merde "" le pire fifa de tout les temps. Ce jeu est une insulte aux football. Un 04/20 pour les graphismes toujours aussi bons et les quelques nouvelles cinématiques. Le reste mérite 0",4,29/09/2023,6,2,nombre mots résume sports grosse merde pire fifa temps jeu insulte aux football graphismes toujours aussi bons quelques nouvelles cinématiques reste mérite,anger
J’ai créé un compte exprès pour pouvoir déverser ma haine pour ce jeu 😂😂Le site donne 16/20 là y a un gros problème d’intégrité ! Comment peut-on donner une note pareille ? C’est du foutage de gueule ! Honte à vous qui induisez en erreur vos lecteurs !Ce jeu est une bouse complète ! Défense ingérable inaccessible pour un joueur casual ! Que des tryharder injouable qui dribblent dans tous les sens sans aucune construction. Une parodie de football avec des scores de hand ball ! J’avais pas rejoué depuis le Fifa18 et je me suis rappelé pourquoi…Je l’ai eu dans le pack PS5 sinon j’aurai jamais acheté cette merde !,0,14/03/2024,4,1,créé compte exprès pouvoir déverser haine jeu site donne gros problème intégrité comment peut donner note pareille foutage gueule honte induisez erreur vos lecteurs jeu bouse complète défense ingérable inaccessible joueur casual tryharder injouable dribblent tous sens sans aucune construction parodie football avec scores hand ball avais rejoué depuis fifa suis rappelé pourquoi pack sinon aurai jamais acheté merde,anger
