review,notes,dates,accords_avis,dessaccords_avis,cleanned_review,classification
UN 0/20 BIEN MÉRITÉ ! Parce que j’aime trop ce sport qu’est le football et que ce jeu ressemble a tout sauf à ce sport que j’aime tant ! Parce que j’ai mis 79€ dans un jeu qui n’est même pas finit…. Nous sommes en Mars et c’est la première que je désinstalle un Fifa aussi tôt dans l’année. C’est tout simplement le pire Fifa jamais sortie et je sais de quoi je parle je suis un adepte depuis le 2004. Le jeu est tout simplement horrible ! Parlons de cette impression que vos joueurs patine ! Comment EA peut voir ça et sortir le jeu sans jamais corrigé cette horreur les joueurs glisse littéralement sur le terrain. Les animations complètement irréaliste une jambe qui passe a travers l’autre essayé en contrôlant Messi de faire des gauche droite avec votre joystick gauche vous allez voir que le gars est littéralement assis ! COMMENT EST-CE POSSIBLE !? Le GAMEPLAY problème majeur de ce EAFC24 …Le pire tout fifa confondu mais bon pas grave les cheveux des joueurs bouge et les lacets des chaussures aussi. L’intelligence artificielle… C’est tout simplement impossible de jouer dans l’axe les déplacements sans ballon sont nul aucun joueurs qui vient chercher le ballon dans l’axe le BU qui se cache derrière les défenseurs adverses quand vous avez le ballon au milieu de terrain vos défenseurs qui vous fonce dessus.. MON DIEU. Le moteur graphique FROSBITE est complètement cassé tant qu’EA continuera de travailler avec on se coltinera le même jeu merdique pendant des années. Étant fan du mode carrière (malgré le manque de nouveautés à travers les années) je suis force de constater qu’il n’y a zéro nouveauté intéressante. EA a quand même cette année retirer l’une des seules choses immersive.. L’entrée avec l’affichage des compos etc … Ils ont pensé que ce serait une bonne idée de le retirer les gars réfléchisse à l’envers. Il y surement d’autres chose que j’oublie. Mais ce jeu et ses développeurs ne mérite même pas un 1 ou 2 je vois certaines personnes dire « Je met une bonne note pour remonter un peu la note globale du jeu » C’est a cause de ce genre de réaction qu’on paye pour pour un jeu merdique depuis tant d’années qu’EA nous sorte le même jeu horrible depuis Fifa 18. Vous vous rendez compte que le dernier vrai bon date d’il y a 7 ans…UNE HONTE 0/20,0,02/03/2024,1,0,bien mérité parce aime trop sport football jeu ressemble sauf sport aime tant parce mis jeu finit nous sommes mars première désinstalle fifa aussi tôt année simplement pire fifa jamais sortie sais parle suis adepte depuis jeu simplement horrible parlons impression vos joueurs patine comment peut voir sortir jeu sans jamais corrigé horreur joueurs glisse littéralement terrain animations complètement irréaliste jambe passe travers autre essayé contrôlant messi faire gauche droite avec votre joystick gauche ,sad
Alors que dire que dire....Adepte de la licence pc depuis Fifa 15 j'ai toujours été un fidèle joueur achetant chaque année le nouvel opus.Cela a aussi été le cas pour le 24 sauf que là problème. Déjà depuis le 23 j'avais quelques problèmes au niveau du lancement du jeu m'obligeant quasi systématiquement à désinstaller ou à bidouiller leur système anti-triche à la c*n mais j'arrivais tout de même à jouer sans problèmes. Arrive le 24 je met 60 euros pour y jouer : 15h...En effet au mois d'octobre arrive une maj après laquelle je n'ai plus jamais pu lancer mon jeu. Me rappelant les problèmes de son prédécesseur je vais sur des forums pour me renseigner je m'aperçois alors que d'autres joueurs ont le même problème que moi : l'anti-cheat se lance écran noir puis le jeu se ferme.  Plusieurs solutions émergent mais concrètement aucune ne marche. Après avoir tout mais TOUT essayé je me résigne à attendre une nouvelle maj qui pourrait régler le problème. Ahah mais quelle réactivité d'EA !!Un problème datant du mois d'octobre nous sommes bientôt au mois de mars aucun mais AUCUN effort n'a été fait que ça soit au niveau d'une maj ou même d'une simple réponse du service client parfaitement inutile. EA s'en fout de ses joueurs pc qui doivent se débrouiller par eux-mêmes pour lancer un jeu qu'ils ont payé 60 balles. Après quasiment 10 ans de fidélité EA viennent de perdre un client.Conclusion: 60 euros déboursés pour 15h de jeu et bien sûr impossibilité de remboursement.C'est vraiment dégueulasse de prendre à ce point les clients pour de la m*rde.,0,29/02/2024,1,0,alors dire dire adepte licence depuis fifa toujours été fidèle joueur achetant chaque année nouvel opus cela aussi été cas sauf problème déjà depuis avais quelques problèmes niveau lancement jeu obligeant quasi systématiquement désinstaller bidouiller leur système anti triche arrivais jouer sans problèmes arrive met euros jouer effet mois octobre arrive maj après laquelle jamais lancer mon jeu rappelant problèmes son prédécesseur vais forums renseigner aperçois alors autres joueurs ont problème moi anti c,sad
"Je poste après 27h de jeu je l'ai acheté y a peut-être 1 mois...""Heureusement"" je l'ai acheté ""que"" 25 € même si c'est 20 € de trop.Je joue principalement en carrière joueur et j'ai toujours eu cette impression qu'EA doivent supprimer des choses pour les remplacer par d'autres choses qui étaient déjà là y a genre 10 ans.Ils peaufinent vite fait pour faire genre c'est nouveau et basta.Pourquoi je ne peux pas partir en prêt ?Pourquoi les bandes chevilles ont été enlevés ?Pourquoi les entrées aussi ?Pourquoi mes coéquipiers me bouchent le chemin ?Pourquoi mon poste n'est jamais respecté quand je change de club ?Je suis le seul à pas trop kiffer le nouveau système avec un agent ?C'était bien d'être approché par différents club et faire son choix là en fait on choisit comme on veut du moment qu'on remplie les objectifs...Et pourquoi j'ai pas droit à une cinématique moi en tant que joueur ?J'ai aussi envie de voir la tronche de mon agent en cinématique + voir mon pro et la signature du contrat... J'ai peut-être envie de négocier ma durée de contrat ou mon salaire.J'ai peut-être envie aussi de me plaindre de mon salaire durant la saison comme l'on fait les joueurs quand on fait une carrière manager.Pourquoi c'est réservé à la carrière manager ? Et le nouveau système de personnalité avec les points inutiles j'ai l'impression que ça a aucun impact lors d'un match.Je vais pas parler du mode FUT où ils ont osé foutre des hommes et des femmes mélangés et nous faire croire qu'une Alana Cook fout un coup d'épaule à Haaland... Faut pas déconner quand même.En fait on dirait une version BETA où EA fourrent tout et on verra par la suite.Pour le FC25 :Ils vont rajouter l'option prêt avec option d'achat mais en améliorer pour faire passer la pilule puis éventuellement remettre les bandes chevilles et à la place des entrées ils vont nous sortir un nouveau geste technique inutile.Peut-être une énième cinématique inutile.",4,28/02/2024,1,0,poste après jeu acheté peut être mois heureusement acheté trop joue principalement carrière joueur toujours impression doivent supprimer choses remplacer autres choses étaient déjà genre ans peaufinent vite fait faire genre nouveau basta pourquoi peux partir prêt pourquoi bandes chevilles ont été enlevés pourquoi entrées aussi pourquoi mes coéquipiers bouchent chemin pourquoi mon poste jamais respecté quand change club suis seul trop kiffer nouveau système avec agent était bien être approché différents cl,anger
Terrible.Que des bugs.Injouable.Plateforme d'échange désagréable aucune constructiveJe rajoute des caractères pour que l'avis soit assez long mais il n'y a rien à ajouter,0,25/02/2024,1,0,terrible bugs injouable plateforme échange désagréable aucune constructiveje rajoute caractères avis soit assez long rien ajouter,sad
Le plus mauvais jeu de sport qui m'ait été de jouer.2 points pour le contenu et le visuel général qui est assez bon. Parlons du gameplay il n'existe pas il est régi par des scripts même contre l'IA. Quand on a le ballon c'est assez plaisant mais lorsqu'il faut défendre c'est n'importe quoi les joueurs glissent tacle à côté se font prendre de vitesse perdent tous les contres et n'ont aucune réactivité. C'est une galère la physique est complètement buggé ce qui prouve un manque complet de compétences chez les codeurs ou alors aucune connaissance de ce sport chez les développeurs. Pour finir un sport si important et qui s'adapte parfaitement au jeux vidéo est monopolisé malheureusement par une société qui ne le respecte pas c'est lamentable.,2,23/02/2024,1,0,mauvais jeu sport ait été jouer points contenu visuel général assez bon parlons gameplay existe régi scripts contre quand ballon assez plaisant lorsqu faut défendre importe joueurs glissent tacle côté font prendre vitesse perdent tous contres ont aucune réactivité galère physique complètement buggé prouve manque complet compétences chez codeurs alors aucune connaissance sport chez développeurs finir sport important adapte parfaitement jeux vidéo monopolisé malheureusement société respecte lamentable,sad
Il faut détester le football pour aimer ce navet ! INJOUABLE ! Ce titre est tout simplement grotesque ! Avec un produit comme celui-là EA Sports se moque clairement des joueurs ! Jeu desinstallé à vendre...Cette fois EA et moi c'est bel et bien terminé ! Boycott total 👎,0,13/02/2024,1,0,faut détester football aimer navet injouable titre simplement grotesque avec produit comme celui sports moque clairement joueurs jeu desinstallé vendre fois moi bel bien terminé boycott total,anger
WORST GAME EVER EVER EVER CLUB PRO NOTHING IS WORKING BOTS ARE JUST A JOKEFUT BULSHIT AGAIN  BROKEN CARDS  BROKEN REWARDSTRANSFERT MARKET FREEZING JUST DELETE THIS GAME,0,28/01/2024,1,0,worst game ever ever ever club pro nothing working bots are just jokefut bulshit again broken cards broken rewardstransfert market freezing just delete this game,sad
Je sais même pas pourquoi j’ai acheté cette dope je le savais déjà depuis 20 j’achète plus aucun fifa et même avant cette année la j’étais déçu des autres 2017 / 2018 / 2019 bref j’ai craqué pour une bouze . Honnêtement en 2h vous avez fait le tour du jeu … circulez il y a rien à voir,0,21/12/2023,1,0,sais pourquoi acheté dope savais déjà depuis achète aucun fifa avant année étais déçu autres bref craqué bouze honnêtement avez fait tour jeu circulez rien voir,sad
Fc24 est le pire de tous !!! J'ai jouer à tout les fifa mais celui là est injouable ! J'ai jamais vue une défense aussi merdique des gardiens inexistant et tout c'est contre favorable alors que c'est impossible de voir va en vrai insupportable. J'ai jouer 20 match je suis déjà à bout ! N'achetez surtout pas le jeux cette année !,0,13/12/2023,1,0,pire tous jouer fifa celui injouable jamais vue défense aussi merdique gardiens inexistant contre favorable alors impossible voir vrai insupportable jouer match suis déjà bout achetez surtout jeux année,sad
Jouez à EA FC 24 et jouez ensuite à fifa 14. 10 fifa en dessous donc 10 jeux en dessous C'EST LE MÊME JEU !!! AUCUNE AMÉLIORATION RIEN seul truc de meilleur dans EA FC c'est légèrement les graphismes. On nous vend la même daube chaque année c'est scandaleux et nous comme des pigeons on achète c'est l'année de trop pour moi,0,07/12/2023,1,0,jouez jouez ensuite fifa fifa dessous jeux dessous jeu aucune amélioration rien seul truc meilleur légèrement graphismes nous vend daube chaque année scandaleux nous comme pigeons achète année trop moi,anger
Injouable le mec prend le ballon impossible de lui prendre j'ai jamais vue 1 fifa aussi mal fait c'est pas du foot sa ya trop de chose péter une simulation sa c'est 1 sketch le jeu tu te retourne encore et encore le ballon tu peut pas le prendre impossible double pressing se que tu veut les frappes c'est quand le jeu a décidé bref scrypter a fond plus cava plus c'est de la merde choquer du gameplay degeulasse,2,05/11/2023,1,0,injouable mec prend ballon impossible lui prendre jamais vue fifa aussi mal fait foot trop chose péter simulation sketch jeu retourne encore encore ballon peut prendre impossible double pressing veut frappes quand jeu décidé bref scrypter fond cava merde choquer gameplay degeulasse,sad
UNE CALAMITE !Un jeu catastrophique beaucoup trop méta et qui ne ressemble en rien à du football !Si en plus vous rajoutez le script omniprésent lorsque vous jouez en ligne vous obtenez l'arnaque du siècle.Ce jeu est une fraude sans nom EA ne se cache pas dans sa volonté de prendre les gens pour des débiles.,0,03/11/2023,1,0,calamite jeu catastrophique beaucoup trop méta ressemble rien football rajoutez script omniprésent lorsque jouez ligne obtenez arnaque siècle jeu fraude sans nom cache volonté prendre gens débiles,anger
De pire en pire en pire en pire comment c’est possible me diriez vous ?Et bien EA a la réponse à votre question !Je ne vais pas lister tous les problèmes de ce jeu car j’en aurai pour des heures je vais parler du plus gros problème qui est le rééquilibrage dans les matchs.De quel droit le jeu nous impose une variation du niveau de jeu de nos joueurs ?On gagne nos joueurs deviennent nul puis on perd -> c’est génial !Des bugs jamais corrigés…Pourquoi la conduite de balle de Messi Prime est accessible à tout le monde ? 😅Vous l’aurez compris que ce jeu est naze.(Ps: je suis div élite et fait rang 1 à fut champ),0,03/11/2023,1,0,pire pire pire pire comment possible diriez bien réponse votre question vais lister tous problèmes jeu car aurai heures vais parler gros problème rééquilibrage matchs quel droit jeu nous impose variation niveau jeu nos joueurs gagne nos joueurs deviennent nul puis perd génial bugs jamais corrigés pourquoi conduite balle messi prime accessible monde aurez compris jeu naze suis div élite fait rang fut champ,sad
catastrophique comme à son habitude. ce n'est pas une simulation mais bel et bien un jeu Arcade. à quand un vrai jeu de foot ??????????????????????????,0,01/11/2023,1,0,catastrophique comme son habitude simulation bel bien jeu arcade quand vrai jeu foot,sad
Une daube monumentale pay too fast pay to win bien trop présent dans le jeu. La jouabilité horrible on a l'impression de jouer à un PES bêta... Et dites vous que le pire dans tous ça c'est que ça va être le FIFA le plus rentable de l'histoire puisqu'ils ne payent plus aucun droit à la FIFA. UNE BELLE ARNAQUE PLANÉTAIRE,0,01/11/2023,1,0,daube monumentale pay too fast pay win bien trop présent jeu jouabilité horrible impression jouer pes bêta dites pire tous être fifa rentable histoire puisqu payent aucun droit fifa belle arnaque planétaire,anger
De la déception j’hésite à retourner sur un ancien FIFA surtout plus la petite music de la LDC avant les matchs ni compo des équipes il parle de réalisme mais ils enlèvent le réalisme qui fait le début d’un match,10,28/10/2023,1,0,déception hésite retourner ancien fifa surtout petite music ldc avant matchs compo équipes parle réalisme enlèvent réalisme fait début match,sad
"Un mode solo délaissé encore une fois qui est littéralement le même que les (10?) dernières années un Volta qui était pourtant prometteur quelques années auparavant et qui n'est désormais plus qu'un mode dérisoire inutile comblé par des bots au vu du manque de joueurs.Tout a été misé sur Ultimate Team qui est DE-SA-STREUX. Le matchmaking est désormais inexistant contrairement à auparavant où le jeu vous faisait tomber contre des joueurs qui avaient une équipe au moins à peu près équivalente. Vous ne faites que tomber contre des joueurs qui ont vendu leur âme au jeu au moins 4 matchs sur 5 se font contre des joueurs qui ont payé et ont des équipes prêtes a littéralement démolir la vôtre. Le manque de joueur sur le jeu rend la possibilité de se faire des crédits compliqué avec un marché très peu actif. Votre seule solution pour vous en sortir : payer.Le jeu manque cruellement de finition et de réalisme le dribble est devenu bien trop puissant les joueurs lourds à manier les gardiens ont une hitbox qui n'a pas de sens (qui est littéralement invisible). 60€ pour un jeu rempli de bugs en tout genre avec des poteaux qui apparaissent en plein milieu du terrain et ne disparaissent pas de tout le match (bloquant ainsi la vision) des statistiques qui s'affichent en énorme sur le terrain qui gênent parfois à la lecture du jeu (certaines qui plus est sont buggées et n'affichent que des carrés noirs) un menu très peu ergonomique avec des notifications inexistantes (obligé de quitter le jeu et de revenir pour voir les notifications disparaître) le jeu rend une copie bien pâle et fade qui ne justifie aucunement son achat par rapport à son prédécesseur. Très mauvais investissement pour ma part ne faites pas la même erreur. 60€ c'est déjà énorme pour ce que vend le jeu sans compter tout ce qu'il vous faudra verser en plus si vous voulez être au niveau de vos adversaires.Le jeu reste bien sûr le théâtre de l'anti-jeu et de l'humiliation une fois en ligne (ce qui ne change pas des autres années)2 points tout de même car il reste fonctionnel techniquement mais la dimension de Gatcha est beaucoup trop grande et les ""améliorations"" n'ajoutent rien au jeu elles le font même régresser. Un style de jeu à bannir qui ne fait que vous pousser vers la consommation.",2,26/10/2023,1,0,mode solo délaissé encore fois littéralement dernières années volta était pourtant prometteur quelques années auparavant désormais mode dérisoire inutile comblé bots manque joueurs été misé ultimate team streux matchmaking désormais inexistant contrairement auparavant jeu faisait tomber contre joueurs avaient équipe moins peu près équivalente faites tomber contre joueurs ont vendu leur âme jeu moins matchs font contre joueurs ont payé ont équipes prêtes littéralement démolir vôtre manque joueur jeu rend p,sad
Je vais le revendre pour pouvoir acheter PES 2020 à la place.Le Gameplay est épouvantable la défense complètement inexistante on pourrait presque marquer des buts de la tête en étant allongé sur la pelouse tellement la défense et les gardiens sont nuls.,0,24/10/2023,1,0,vais revendre pouvoir acheter pes place gameplay épouvantable défense complètement inexistante pourrait presque marquer buts tête étant allongé pelouse tellement défense gardiens nuls,sad
On paye 70 balles pour ca serieux ! Ca n’a strictement rien avoir avec du football ! C’est du pay to win . Les gens mettent leurs argent pour avoir des bons joueurs et faire des tout droits . Les goals sont inexistants. Vraiment n’achetez pas cette chose qui sert de jeu vous serez deçu,0,24/10/2023,1,0,paye balles serieux strictement rien avec football pay win gens mettent leurs argent bons joueurs faire droits goals inexistants vraiment achetez chose sert jeu serez deçu,anger
En tant que joueur de FIFA de longue date cet opus est une véritable catastrophe en termes de gameplay rempli de bugs répugnants. Nous sommes en 2023 bon sang !,1,23/10/2023,1,0,tant joueur fifa longue date cet opus véritable catastrophe termes gameplay rempli bugs répugnants nous sommes bon sang,sad
Gameplay catastrophique jamais vue un FIFA aussi nul un script vraiment incroyable des tacles de fou furieux qui n'as aucun impact des bugs à tout va vraiment c'est plus horrible que sympathique de jouer a ce jeux le seul truc positif du jeux c'est que les cartes sont belles  à part ça tout le reste est éclaté de A à Z un conseil gardez votre argent car ce jeux est une perte de temps.,1,23/10/2023,1,0,gameplay catastrophique jamais vue fifa aussi nul script vraiment incroyable tacles fou furieux aucun impact bugs vraiment horrible sympathique jouer jeux seul truc positif jeux cartes belles part reste éclaté conseil gardez votre argent car jeux perte temps,sad
Ce jeux est sorti foul bug. Faut encore attendre 3-4mois cette année pour qu'il soit finit.Tout est toujours QUE pour FuT. Qu'ils sortent un jeux à part free to play avec des saisons pour vendre leurs nouvelles cartes qu'on en parle plus.Ici sur club pro mode très intéressant et complètement délaissé. Pendant 3 semaines impossible de trouver un match. Maintenant que c'est réglé et qu'on puisse monter son pro quoi?Les étoiles gestes techniques et mauvais pieds ne se fixe pas. Tu peux mettre 4 ou 5 étoiles geste technique en match ce sera toujours 3.Tu montes ton pro pour rien .. en carrière plein de bug cinématique transfert maillots.. annonceur..Bref vivement un bon concurrent que EA se bouge un peu les fesses sur un vrai jeux de foot et du gameplay plutôt que mettre toute l'énergie sur des techniques de ventes et commerciale pour FuT.,6,15/10/2023,1,0,jeux sorti foul bug faut encore attendre mois année soit finit toujours fut sortent jeux part free play avec saisons vendre leurs nouvelles cartes parle ici club pro mode très intéressant complètement délaissé pendant semaines impossible trouver match maintenant réglé puisse monter son pro étoiles gestes techniques mauvais pieds fixe peux mettre étoiles geste technique match sera toujours montes ton pro rien carrière plein bug cinématique transfert maillots annonceur bref vivement bon concurrent bouge peu,anger
Merci aux joueurs de donner de VRAIES notes pour ce nouveau DLC de la part d'EA Sports.Encore une fois on se moque des joueurs pour le prix du jeu on a une MAJ de Fifa 23 un mode Fut qui accueille les féminines pourquoi ne pas faire un mode féminine au sein même de Fut et laisser le mode de base ? Aucune idée.Le mode carrière est toujours le même quelques améliorations anecdotiques encore une fois les animations sont les mêmes malgré tout ..Pas de profondeur dans le jeu comme on peut le voir sur un NB2k par exemple...Les notes des joueurs sont incohérentes ils ne doivent pas regarder les matchs.Gameplay encore moins bon que les années précèdentes gardiens horribles contres à tout va pour l'attaquant les appels sont d'une médiocrité toujours les mêmes aucune tactique n'est réellement possible puisque l'IA des joueurs est aléatoire. L'arbitrage est pareil incompréhensible cartons jaune pour des fautes qui méritent une peine de prison...Bref rien de surprenant cette année encore.Vivement un concurrent ! A boycotter au lieu d'enrichir cette médiocrité.,1,12/10/2023,1,0,merci aux joueurs donner vraies notes nouveau dlc part sports encore fois moque joueurs prix jeu maj fifa mode fut accueille féminines pourquoi faire mode féminine sein fut laisser mode base aucune idée mode carrière toujours quelques améliorations anecdotiques encore fois animations mêmes malgré profondeur jeu comme peut voir nbk exemple notes joueurs incohérentes doivent regarder matchs gameplay encore moins bon années précèdentes gardiens horribles contres attaquant appels médiocrité toujours mêmes auc,sad
Pour le moment c’est une vraie purge ! J’espère sincèrement que des MAJs vont sortir bientôt parce que là ça en devient risible…Aucun plaisir à gagner les buts sont cadeaux car les gardiens n’existent pas si on sait un minimum frapper c’est 80% de chance de marquer tellement les gardiens sont mauvais (même des Alisson ou autre grands gardiens à 90) et les défenseurs c’est encore plus scandaleux… Apparement ils sont fait en gruyère les attaquants les traversent littéralement quand il y a des contacts ou des dribbles le moindre changement de trajectoire met au tapis 2-3 défenseurs/milieux le défenseur sélectionné est seul contre tous car l’IA coéquipier est inexistant aucun marquage ni placement c’est triste à voir.Même en testant le mode carrière en légendaire c’est mauvais des scores à base de 7-2 / 8-5 / 5-4 à chaque fois tellement c’est easy de planter et de se prendre des buts aussi… Vraiment déçu par le jeu !Je passe sous silence tous les bugs du jeu que ça soit dans certains menus ou dans le gameplay parce que sinon ça serait trop long…,2,07/10/2023,2,2,moment vraie purge espère sincèrement majs vont sortir bientôt parce devient risible aucun plaisir gagner buts cadeaux car gardiens existent sait minimum frapper chance marquer tellement gardiens mauvais alisson autre grands gardiens défenseurs encore scandaleux apparement fait gruyère attaquants traversent littéralement quand contacts dribbles moindre changement trajectoire met tapis défenseurs milieux défenseur sélectionné seul contre tous car coéquipier inexistant aucun marquage placement triste voir t,sad
Après 30 heures de jeu et venant de l’école PES depuis les années 90 mon verdict est que ce n’est pas du football. Une attaque/défense (avec un système défensif inexistant). Une foutaise. 5 points pour Volta car j’en attendais rien et c’est divertissant en local avec des potes.,5,05/11/2023,1,1,après heures jeu venant école pes depuis années mon verdict football attaque défense avec système défensif inexistant foutaise points volta car attendais rien divertissant local avec potes,sad
Je pensais au moins qu'ils allaient changer quelque chose mais non. Mode carrière pauvre le jeu est beug de partout l'ont-ils testé ?? Aucun changements avec les anciens fifa trop rapide irréaliste aucune atmosphère. Ne l'achetez pas ça ne vaut pas la peine.,2,23/10/2023,1,1,pensais moins allaient changer quelque chose non mode carrière pauvre jeu beug partout ont testé aucun changements avec anciens fifa trop rapide irréaliste aucune atmosphère achetez vaut peine,sad
