review,notes,dates,accords_avis,dessaccords_avis,cleanned_review,classification
Bien content de ne plus acheter ce jeu depuis fifa 21. J'ai tout de même l'occasion d'y jouer lorsque mon neveu vient chez moi je lui fais quelque matchs FUT lorsqu'il a besoin de gagner... mais qu'est que c'est nul franchement.J'étais un puriste de PES et je suis passé sur fifa en 2010 justement parce que le 1er devenais bcp trop arcade alors que fifa proposait une possession de balle bien plus réaliste des course solitaires en dribbles difficile à réalisé etc... Aujourd'hui on a que des scores fleuve tu peux mener 5-0 à la mt et perdre 7 a 8.Les défenses sont si nuls et tjrs mal placé et qd bien meme on se positionne bien le script fais que votre joueur donne la sensation de glisser sur le terrain et n'intercepte pas la balle sauf s'il est largement meilleur que les joueurs en face ou la c'est le contraire et récupère des balles même dans une direction que vous n'avez pas choisi.Les gestes techniques a tout va qui n'ont jamais d'échec à croire qu'on peut enchaîner 8-9 geste les plus fou sans jamais perdre le contrôle du ballon ni se fatiguer on se croirait plus dans FifaStreet.Globalement le jeu est joli même si c'est tjrs les mêmes graphismes certaines animations sont bien faite mais qu'est qu'on s'en fou... on veut du vrai gameplay des matchs on l'on cherche des solutions par des passe ou des dribbles risquer mais qui demande bien plus de maîtrise et de timing que de simplement tourner le joystick droit dans tous les sens.  Bref ce jeu plaît au plus jeunes parce qu'ils jouent avec leurs idoles et fantasme sur leurs équipe composé des meilleurs joueurs.. mais depuis l'arrivé du mode FUT grosse pompe à fric ce jeu est simplement mauvais. Les années en saison simple était bien meilleur il me manquais que dès match type LDC ou d'autre challenge plus prenant.  Le mode club pro était le seul qui me tenais sur ce jeu de 2014 à 2021 et il a tjrs été laissé de côté une progression nuls des joueurs qui atteignent tous 98 et cours partout sur le terrain sans respect de leur poste qui ne les fatigue a peine. Bref un copier coller encore une fois avec des ajouts nuls et sans fond  comme des bandes sonores ou des tifo a n'en plus voir les supporters. Je suis pas Fan de l'ajout des joueuses féminines mais c'est pas très important ça ne m'aurais pas empêcher d'y jouer si le jeu avait été bon. Faut vraiment que les gens arrête de l'acheter et de dépenser de l'argent dans FUT qu'ils puissent se remettre en question. J'ai testé E-Football et si c'est bcp plus dur de passer des dribble le jeu m'avais l'air bien scripter aussi et relativement pauvre en gameplay. 0 concurrence c'est dommage qu'on puisse pas enfin reprendre du plaisir dans un jeu de foot sérieux.,1,02/10/2023,4,1,bien content acheter jeu depuis fifa occasion jouer lorsque mon neveu vient chez moi lui fais quelque matchs fut lorsqu besoin gagner nul franchement étais puriste pes suis passé fifa justement parce devenais bcp trop arcade alors fifa proposait possession balle bien réaliste course solitaires dribbles difficile réalisé etc aujourd hui scores fleuve peux mener perdre défenses nuls tjrs mal placé bien meme positionne bien script fais votre joueur donne sensation glisser terrain intercepte balle sauf largem,neutral
Essayé sur EAplay  j'ai économisé 70€bugsmenugameplaymode carrière tout est moins bien que FIFA 23passez votre chemin si vous recherchez a prendre du plaisir de jeux sur le rectangle vert car la c'est l'ennuie le plus total,2,02/10/2023,4,1,essayé eaplay économisé bugsmenugameplaymode carrière moins bien fifa passez votre chemin recherchez prendre plaisir jeux rectangle vert car ennuie total,sad
Allez je mets 2 pour les graphismes parce que c'est quand même joli.Sinon gameplay à chier on prend aucun plaisir à jouer et j'ai l'impression que c'est de pire en pire. Depuis FIFA 13 et 14 j'ai l'impression que cette licence est finie.Cette année j'ai eu la curiosité d'aller voir le mode FUT mais faut encore raquer pour jouer ou level up c'est un scandale,2,01/10/2023,4,1,allez mets graphismes parce quand joli sinon gameplay chier prend aucun plaisir jouer impression pire pire depuis fifa impression licence finie année curiosité aller voir mode fut faut encore raquer jouer level scandale,sad
Je joue à la play depuis 26ans. Ce jeu est le premier que j'ai vraiment eu envie de vendre dommage je l'ai acheté sur le store. Y'a deux fifa que j'ai pas prit sur les 20 dernières années celui là me fait arrêter. J'espère que le flambeau sera reprit par des développeurs qui aiment plus le foot que les jeux de cartes à payer sinon c'est mon dernier jeu de foot.,0,10/12/2023,2,0,joue play depuis ans jeu premier vraiment envie vendre dommage acheté store deux fifa prit dernières années celui fait arrêter espère flambeau sera reprit développeurs aiment foot jeux cartes payer sinon mon dernier jeu foot,sad
Si l'on pouvait mettre moins de 0/20 j'aurais mis -40.Je vais donner mon avis très franchement cette ANNEE le jeu est une horreur sans nom :le script les lags les contres favorables l'ARBITRAGE (INCROYABLEMENT A CHIER cest du nimporte quoi)depuis fifa 12 tu n'as qu'a appuyer sur l1+triangle a travers tout le terrain et a enrouler a 46metres pour mettre un butLe jeu est injouable si vous ne regardez pas 4123 tutos sur tiktoks ou youtube pour apprendre les 10 TECHNIQUES LES PLUS BROKEN de cette année le jeu est une HORREUR SANS NOM tous les ans je perds 40€ à l'acheter je joue 1 mois et je suis degouter pendant 11... on est en novembre je pete mon cranePour resumer le jeu EST HORRIBLE.... (je joue exclusivement en club pro*)A fuir GO BOYCOTT,0,06/11/2023,2,0,pouvait mettre moins aurais mis vais donner mon avis très franchement annee jeu horreur sans nom script lags contres favorables arbitrage incroyablement chier cest nimporte depuis fifa appuyer triangle travers terrain enrouler metres mettre butle jeu injouable regardez tutos tiktoks youtube apprendre techniques broken année jeu horreur sans nom tous ans perds acheter joue mois suis degouter pendant novembre pete mon cranepour resumer jeu horrible joue exclusivement club pro fuir boycott,sad
Je ne sais même pas par où commencer.. ce jeu se dégrade d'année en année au regard de ses bugs récurent tantôt dans le gameplay que dans le menu. Quand on joue on a littéralement peur qu'un bug se produise et nous fait encaisser un but : joueur qui ralentit sans raison joueur qui ne réagit pas le gardien qui saute à l'envers joueur qu'on ne peut pas sélectionner (oui l'algorythme pour la sélection des joueurs est un véritable fiasco) etc la liste est très longue. Cela nuit fortement à l'expérience de jeu d'autant plus que des bugsdu type : menu ultimate team qui ne charge plus score board qui bug et affiche un mauvais score ou disparait etc rendent ce jeu baclé. Alors oui il y a des points positifs comme l'excellent graphisme visuel la multitude de mode de jeu etc mais d'un point de vue général ce jeu n'est plus ce qu'il était avant 2018,1,22/10/2023,2,0,sais commencer jeu dégrade année année regard ses bugs récurent tantôt gameplay menu quand joue littéralement peur bug produise nous fait encaisser but joueur ralentit sans raison joueur réagit gardien saute envers joueur peut sélectionner oui algorythme sélection joueurs véritable fiasco etc liste très longue cela nuit fortement expérience jeu autant bugsdu type menu ultimate team charge score board bug affiche mauvais score disparait etc rendent jeu baclé alors oui points positifs comme excellent graphi,sad
Étant un grand fan de la franchise cet année je me suis posé la question à savoir si je jouais vraiment à FIFA ( EA sport FC 24). C’est le pire Fifa que j’ai eu à jouer étant un adepte de ce jeu depuis 2012. Aucune sensation aucun plaisir aucun réalisme dans le gameplay. Ça ressemble plus à un jeu de tenis qu’à un jeu de foot. Je regrette même d’avoir acheter cet Opus tellement on ne ressent plus l’ADN de FIFA,1,20/10/2023,2,0,étant grand fan franchise cet année suis posé question savoir jouais vraiment fifa sport pire fifa jouer étant adepte jeu depuis aucune sensation aucun plaisir aucun réalisme gameplay ressemble jeu tenis jeu foot regrette acheter cet opus tellement ressent adn fifa,sad
1 unique point pour la quantité des équipes presentent sur le jeu.Le reste du jeu est un scandale sans nom.Pompe à fric depuis des années le gameplay est de pire en pire depuis 10 ans. Le script omniprésent dans tous les matchs les contre favorables la vitesse des joueurs n’est pas respectée par rapport a ce que le jeu dit (un défenseur de 65 de vitesse peut etre plus rapide qu’un attaquant ayant 90 … bref incompréhensible ce jeu). Et le clou du suspens les courses R1 et les gardiens sont catastrophiques pour le bon déroulement du jeu. Trop de bugs sont présents sur le jeu depuis des années et rien n’a ete fait pour corriger cela. « Le jeu de football le plus réaliste » disent-ils…Je prenais plus de plaisir à jouer à Fifa 98 sur PS1.Bref amateur de football fuyez le jeu. Économisez 50€ pour aller voir un vrai match de foot.,1,17/10/2023,2,0,unique point quantité équipes presentent jeu reste jeu scandale sans nom pompe fric depuis années gameplay pire pire depuis ans script omniprésent tous matchs contre favorables vitesse joueurs respectée rapport jeu dit défenseur vitesse peut etre rapide attaquant ayant bref incompréhensible jeu clou suspens courses gardiens catastrophiques bon déroulement jeu trop bugs présents jeu depuis années rien ete fait corriger cela jeu football réaliste disent prenais plaisir jouer fifa bref amateur football fuyez,anger
Un jeu d'arcade avec des joueurs trop rapide et des fonctionnalités de gameplay relatives au contrôle des joueurs à l'arrêt absent par rapport à Fifa 23. Des cinématique d'ouverture ridicule sans les compositions d'équipe complètement déconnecté de la réalité !Les matches de hautes intensités sont de véritables foutouard du fait que les joueurs n'ont pas réellement la possession d'un ballon trop versatile ! Pas de stabilité dans la tenue du ballon ! C'est vraiment du grand n'importe quoi !La seule chose que explique les bons résultats de vente de cette bouse c'est que EA est seul sur son marché sans réelle concurrence sérieuse.Il aurait simplement fallut qu'EA reprenne Fifa 23 et le réactualise avec effectif maillot et chaussures pour la nouvelle saison. Au lieu de prendre Fifa 23 et de le détériorer.Un mot pour qualifier ce nouvel opus : ÉCŒURANT.,1,12/10/2023,2,0,jeu arcade avec joueurs trop rapide fonctionnalités gameplay relatives contrôle joueurs arrêt absent rapport fifa cinématique ouverture ridicule sans compositions équipe complètement déconnecté réalité matches hautes intensités véritables foutouard fait joueurs ont réellement possession ballon trop versatile stabilité tenue ballon vraiment grand importe seule chose explique bons résultats vente bouse seul son marché sans réelle concurrence sérieuse aurait simplement fallut reprenne fifa réactualise avec e,sad
Définition parfaite du pay to win comme d’habitude. Plus aucun plaisir à jouer au mode fut. Ajout des féminines dans fut logique plus de cartes donc plus de variantes donc plus de packs et donc plus de tunes on connaît la recette!Avoir des gardiens à plus de 80 de global qui ont le niveau de U15 district 4 mais normal…Comme d’habitude pas d’amélioration ea n’apprend toujours pas de ses erreurs dommage… vivement un conçurent à la hauteur!,1,11/10/2023,2,0,définition parfaite pay win comme habitude aucun plaisir jouer mode fut ajout féminines fut logique cartes variantes packs tunes connaît recette gardiens global ont niveau district normal comme habitude amélioration apprend toujours ses erreurs dommage vivement conçurent hauteur,neutral
"horrible jeu plus d'hymne de la ldc on a au lieu de ça un gros cadre d'objectif dont personne en a quelque chose a faire plus de cinématique d'entrée des joueurs public horriblement mal fait aucun progrès depuis des années les nombreuses catastrophes qui se produisent entre les joueurs (comme a chaque fifa) du style les joueurs qui se rentrent dedans et qui ne tiennent jamais debout les buts gags qui arrivent quasiment a tout les match les niveaux de difficultés en mode carrière qui sont complément éclaté ( en pro c'est des aveugles en face et la difficulté au dessus qui est ""champions"" c'est un injouable) impossibilité de changer la langue des commentaire en match (gros coup dur pour le réalisme) et j'en passe... bref ce jeu est une énorme blague chaque année c'est de pire en pire bref ""FC24"" est largement moins bien que FIFA 15 et c'est une honte absolue ne gaspillez pas votre argent dans cette daube.",1,10/10/2023,2,0,horrible jeu hymne ldc lieu gros cadre objectif dont personne quelque chose faire cinématique entrée joueurs public horriblement mal fait aucun progrès depuis années nombreuses catastrophes produisent entre joueurs comme chaque fifa style joueurs rentrent dedans tiennent jamais debout buts gags arrivent quasiment match niveaux difficultés mode carrière complément éclaté pro aveugles face difficulté dessus champions injouable impossibilité changer langue commentaire match gros coup dur réalisme passe bref ,sad
Est ce que ce jeu mérite 0-20??? Non… il en mériterais plutôt 7/20! C’est une énorme bouze comme tout les FIFA depuis des années. Mais EA est capable chaque année de nous étonner toujours un peu plus! Et de prouver que :1 - Ils se foutent totalement de la gueule de leur client!2 - Qu’ils ne comprennent absolument rien au football!3 - Voyant les gens jouer toujours plus à FÛT et à mettre toujours plus d’argent dans un pack opening se disent que leur clientèle est définitivement lobotomisé et que par conséquent il n’y avait aucune raison de ne pas continuer à se payer leurs tronches!Les gros défauts de ce jeu :- Vitesse de jeu beaucoup beaucoup beaucoup beaucoup trop rapide!- TOUT EST ASSISTÉ!!! (Pressing passe en profondeur blocs) un véritable bonheur pour les joueur META (tout ceux qui ont appris le foot via FUT et qui n’y comprennent rien!) Un enfer pour ceux qui essaie un tant soit peu de jouer au foot!- OPEN BAR AU NIVEAU DU SCRIPT!- L’IA!!!! J’entends très souvent des joueurs se réjouir des nouveautés du mode carrière! Mais je ne comprend pas comment on peut se b….. devant 3 cinématique pour le mode carrière et en oubliez l’essence du jeu! Le Gamplay!!! Et avec une IA pareil c’est tout simplement nul à chier!!!A quoi bon avoir les logo des championnats et des équipes l’affichage officiel du championnat avec les maillots et les stades si c’est pour avoir l’impression de jouer contre une IA totalement debile et en même temps complètement cheater!Qualités : Des super musiques comme très souvent! Mais à 70€ la playlist je vous conseil un abonnement Spotify ou Deezer!Dernier carton rouge adressé au « journaliste » de jeuxvideo.com qui a réalisé la critique de ce FC24!Le chèque venu d’EA devait être assez conséquent pour avoir le culot de mettre 16/20 à cette bouze!Donc Cher Monsieur de 2 choses l’une soit vous vous êtes fait acheter par EA et vous n’avez rien à faire en tant que journaliste soit vous trouvez que ce jeu est réellement bien et a ce moment là vous avez un problème psychatrique et n’avez rien à faire là non plus!Bref que ce soit Jeuxvideo.com ou EA comment arrivez à vous regardez dans la glace le matin?,0,10/10/2023,2,0,jeu mérite non mériterais plutôt énorme bouze comme fifa depuis années capable chaque année nous étonner toujours peu prouver foutent totalement gueule leur client comprennent absolument rien football voyant gens jouer toujours fût mettre toujours argent pack opening disent leur clientèle définitivement lobotomisé conséquent avait aucune raison continuer payer leurs tronches gros défauts jeu vitesse jeu beaucoup beaucoup beaucoup beaucoup trop rapide assisté pressing passe profondeur blocs véritable bonhe,anger
Dire que certains payent 100 € pour le dernier jeu fifa actif  mais qui sont les pigeons qui payent ça 100 balles 😂😂😂. C'est le jeu de foot le plus médiocre auquel je n'ai jamais joué de ma vie. C'est une catastrophe de gameplay ça en devient lunaire.Des gardiens en pâte à modeler des joueurs patineurs artistiques qui tombent toutes les 5 minutes. Un affichage de menu horrible...Bref j'ai payé l'abonnement EA play sur un mois à 0.99  cents d'€ pour tester le jeu 10h sans avoir à le payer en entier et quelle bonne idée de la part de EA que cet abonnement !! Ça confirme toute la médiocrité de leur dernier joujou qui ne vaut même pas 20 € tellement c'est claqué au sol.Sur mes 10 heures de jeu j'ai encore 7h restantes et je comprends pourquoi il est terriblement nullissime. Je suis impressionné par autant de nullité...Ils n'ont pas perdu que la licence avec cet opus ils ont perdu aussi des joueurs. Car il ne reste plus que les plus grosses dindes parmi les amateurs ou mordus de foot pour encore payer pour cette arnaque grandeur nature que dis-je pour cette arnaque mondiale...,0,06/10/2023,2,0,dire certains payent dernier jeu fifa actif pigeons payent balles jeu foot médiocre auquel jamais joué vie catastrophe gameplay devient lunaire gardiens pâte modeler joueurs patineurs artistiques tombent toutes minutes affichage menu horrible bref payé abonnement play mois cents tester jeu sans payer entier quelle bonne idée part cet abonnement confirme toute médiocrité leur dernier joujou vaut tellement claqué sol mes heures jeu encore restantes comprends pourquoi terriblement nullissime suis impressionn,sad
Je pense a fc 24 chaque fois que je m'assoie depuis le 29 septembre des attaquants surpuissants mais des défenseurs et des gardiens nul à chier rendant le jeu complètement déséquilibré donnant des scores de 7-3 ou 8-4 par exemple. Un manque de réalisme total.,0,06/10/2023,2,0,pense chaque fois assoie depuis septembre attaquants surpuissants défenseurs gardiens nul chier rendant jeu complètement déséquilibré donnant scores exemple manque réalisme total,sad
"Le pire ""Fifa"" de l'histoire. Sur UT la defense est catastrophique ils ont essayer de tenter quelque chose mais ce n'est clairement pas au point. A se demander si ils ont réellement eu le temps de finir le jeu où s'ils ont balancé ca comme ca dans l'objectif d'améliorer avec les MAJ.L'attaque est encore une fois et plus que jamais favorisée. Le vrai football est mort dans les jeux videos. Je regrette dd l'avoir acheté. Ce sera le dernier que j'achète si cette merde ne s'améliore pas.",0,03/10/2023,2,0,pire fifa histoire defense catastrophique ont essayer tenter quelque chose clairement point demander ont réellement temps finir jeu ont balancé comme objectif améliorer avec maj attaque encore fois jamais favorisée vrai football mort jeux videos regrette acheté sera dernier achète merde améliore,sad
J’ai revendu le jeu au bout de 3 jours.Le gameplay est catastrophique. Le réalisme inexistant (score de tennis buts improbables erreurs grossières). La liste des problèmes est longue. Tout est à revoir. Je n’ai pas du tout aimé fifa 23 sur xbox one mais je peux vous dire que fifa 22 et fifa 21 sur xbox one était meilleurs. Une lente régression vers ce qu’il y a de pire chez EA ?,2,08/10/2023,3,1,revendu jeu bout jours gameplay catastrophique réalisme inexistant score tennis buts improbables erreurs grossières liste problèmes longue revoir aimé fifa xbox one peux dire fifa fifa xbox one était meilleurs lente régression vers pire chez,sad
'Jeu mal équilibré :'Je n'avais plus joué à un FIFA depuis 4 ou 5 ans je me suis donc laissé tenté par ce EA FC 24.Sur le mode Solo rien à dire tout ce qu'on attends du jeu est bien là j'ai commencé une carrière d'entraineur et pour l'instant l'espérience est agréable.Le problème vient du multi et du gameplay.2 énormes problèmes se pose le premier est au niveau gameplay.Un style de jeu est beaucoup trop fort par rapport aux autres il sagit de la contre attaque si vous ne jouez pas comme ça impossible de gagner le jeu de possession est complétement inutile il y a clairement un problème d'équilibrage dans ce jeu.Le 2 ème gros problème est le mode en ligne j'ai enchainé 18 défaites sur FUT avant de gagner mon premier match le jeu ne prends pas en compte le niveau des joueurs et lance des matchs au hasard il est donc facile de ne tomber que sur des joueurs beaucoup trop fort pour nous surtout quand on achète le jeu day one on en tombe que sur des brutes c'est décourageant.Incroyable qu'il n'y ai pas de système d'élo en 2023. Alors oui quand les forts joueurs auront atteint des divisions élevés ça sera plus jouable mais attendant l'expérience utilisateur est catastrophique.Dernier point négatif concernant l'ajout des femmes sur FUT. Je ne vais pas trop en dire mais ça ruine un peu le réalisme.,9,01/10/2023,3,1,jeu mal équilibré avais joué fifa depuis ans suis laissé tenté mode solo rien dire attends jeu bien commencé carrière entraineur instant espérience agréable problème vient multi gameplay énormes problèmes pose premier niveau gameplay style jeu beaucoup trop fort rapport aux autres sagit contre attaque jouez comme impossible gagner jeu possession complétement inutile clairement problème équilibrage jeu ème gros problème mode ligne enchainé défaites fut avant gagner mon premier match jeu prends compte nivea,sad
jeu tres limitégameplay pauvre dure de passer de fifa23 à ca pourtant le 23 etait pas fou mais la clairement une catale pire jeu de tout les temps et de loin bon le point possitif c'est que saison pro ils peuvent pas faire pire,5,13/10/2023,2,1,jeu tres limitégameplay pauvre dure passer fifa pourtant etait fou clairement catale pire jeu temps loin bon point possitif saison pro peuvent faire pire,sad
Le pire jeu football de cette planète le temps additionnel interminable ou l’arbitrage ne siffle jamais ou encore le faite qu’il est impossible de dégager en touche même pleine puissance beaucoup de bug Seul point positif la Direction artistique est belle,3,20/04/2024,1,0,pire jeu football planète temps additionnel interminable arbitrage siffle jamais encore faite impossible dégager touche pleine puissance beaucoup bug seul point positif direction artistique belle,sad
Le jeu existe encore car il n'y a pas de concurrence..  le mode ultimate team est une catastrophe. Le script une honte. Et tout les pack que l'on gagne devenu non échangeable. Ils font tout pour nous obliger a mettre de l'argent pour pouvoir espérer avoir des joueurs.,1,18/04/2024,1,0,jeu existe encore car concurrence mode ultimate team catastrophe script honte pack gagne devenu non échangeable font nous obliger mettre argent pouvoir espérer joueurs,anger
Pire fifa de tout les temps surtout le mode fut horrible les gens on déjà des équipe a 90 au milieu de jeu des bugs de partout même dans les menues dans le jeu on en parle même pas le gameplay horrible de fou l’acheter pas vous allez juste rage,0,09/04/2024,1,0,pire fifa temps surtout mode fut horrible gens déjà équipe milieu jeu bugs partout menues jeu parle gameplay horrible fou acheter allez juste rage,sad
Le pire 'FIFA' de l'histoire et probablement le pire jeu de football de l'histoire.Après des années et des années de jouer sur FIFA je crois que cette année sera la dernière que j'achète ce jeu.J'espère bien qu'il y aura un autre jeu pour de la concurence espérant également le retour de KONAM,0,13/03/2024,1,0,pire fifa histoire probablement pire jeu football histoire après années années jouer fifa crois année sera dernière achète jeu espère bien aura autre jeu concurence espérant également retour konam,sad
Voilà un jeu de football qui ne ressemble en rien à du football ! L'amusement n'y est pas depuis des années et ce nouvel opus est le pire ! Assurément un grand n'importe quoi,0,11/03/2024,1,0,voilà jeu football ressemble rien football amusement depuis années nouvel opus pire assurément grand importe,sad
Le jeux est vraiment à revoir  c’est vraiment une honte  c’est le jeux le plus beugé de la new génération il faut le relancer tout les 5min parce que il freez le serveur sont toujours pleins du coup impossible de connecter la moitié du temps  et il te font payer cette daube 80€ ? je sais mais pas comment il n’on pas honte d’avoir oser sortir le jeux  mais bon il toujours du fric donc il s’en fiche  mais sa va leurs retomber dessus un de ces jours c’est dommage pour eux,5,06/03/2024,1,0,jeux vraiment revoir vraiment honte jeux beugé new génération faut relancer min parce freez serveur toujours pleins coup impossible connecter moitié temps font payer daube sais comment honte oser sortir jeux bon toujours fric fiche leurs retomber dessus ces jours dommage eux,anger
